{
  "$schema": "https://json-schema.org/draft/2020-12/schema",
  "$id": "openmontage/artifacts/template_run_plan",
  "title": "Template Run Plan",
  "description": "单条模板适配的不可变计划（template_pack → 一条自有视频）。记录模板、商品事实、每个 slot 的素材绑定来源与替换理由、caption policy；是 asset/scene_plan 的共同输入，不绑定来源或理由的 slot 不能进入 paid assets。",
  "type": "object",
  "required": ["version", "run_id", "template_id", "template_pack_ref", "product_facts_ref", "adaptation_policy", "slot_bindings", "caption_policy", "status"],
  "properties": {
    "version": { "type": "string", "enum": ["1.0", "1.1"] },
    "run_id": { "type": "string", "minLength": 1 },
    "template_id": { "type": "string", "minLength": 1 },
    "template_pack_ref": {
      "type": "object",
      "required": ["artifact_sha256", "version"],
      "properties": {
        "artifact_sha256": { "type": "string", "pattern": "^[a-f0-9]{64}$" },
        "version": { "type": "string" }
      },
      "additionalProperties": false
    },
    "product_facts_ref": {
      "type": "object",
      "required": ["artifact_sha256"],
      "properties": { "artifact_sha256": { "type": "string", "pattern": "^[a-f0-9]{64}$" } },
      "additionalProperties": false
    },
    "target_category_id": { "type": "string", "minLength": 1 },
    "category_profile_ref": {
      "type": "object",
      "required": ["path", "profile_id", "category_id", "version", "artifact_sha256"],
      "properties": {
        "path": { "type": "string", "minLength": 1 },
        "profile_id": { "type": "string", "minLength": 1 },
        "category_id": { "type": "string", "minLength": 1 },
        "version": { "type": "string", "minLength": 1 },
        "artifact_sha256": { "type": "string", "pattern": "^[a-f0-9]{64}$" }
      },
      "additionalProperties": false
    },
    "campaign_content_ref": {
      "type": ["object", "null"],
      "properties": {
        "campaign_id": {"type": "string", "minLength": 1},
        "content_slot_id": {"type": "string", "minLength": 1},
        "content_version_id": {"type": "string", "minLength": 1},
        "direction_id": {"type": "string", "minLength": 1},
        "structure_id": {"type": "string", "pattern": "^P[1-6]$"},
        "support_type": {"type": "string", "enum": ["experiment", "trust", "faq", "transaction"]},
        "recipe_id": {"type": "string", "minLength": 1}
      },
      "required": ["campaign_id", "content_slot_id", "content_version_id", "direction_id", "structure_id", "support_type", "recipe_id"],
      "additionalProperties": false
    },
    "adaptation_policy": { "type": "string", "description": "改编策略（如 proof-first / pain-first / story），由模板表达或人工指定" },
    "differentiation_plan_ref": { "type": ["object", "null"], "required": ["name", "path", "artifact_sha256"], "properties": {"name": {"type": "string", "const": "differentiation_plan"}, "path": {"type": "string", "pattern": "^artifacts/[^.].*\\.json$"}, "artifact_sha256": {"type": "string", "pattern": "^[a-f0-9]{64}$"}}, "additionalProperties": false },
    "slot_bindings": {
      "type": "array",
      "items": {
        "type": "object",
        "required": ["slot_id", "source", "reason"],
        "properties": {
          "slot_id": { "type": "string", "minLength": 1 },
          "source": { "type": "string", "enum": ["owned", "generate", "unbound"] },
          "source_media_id": { "type": ["string", "null"] },
          "asset_type": { "type": ["string", "null"] },
          "evidence_row_ids": {
            "type": "array",
            "minItems": 1,
            "maxItems": 1,
            "uniqueItems": true,
            "items": { "type": "string", "minLength": 1 }
          },
          "reason": { "type": "string", "minLength": 1 }
        },
        "allOf": [
          {
            "if": { "properties": { "source": { "const": "owned" } }, "required": ["source"] },
            "then": { "properties": { "source_media_id": { "type": "string", "minLength": 1 } }, "required": ["source_media_id"] }
          },
          {
            "if": { "properties": { "source": { "const": "generate" } }, "required": ["source"] },
            "then": { "properties": { "asset_type": { "type": "string", "minLength": 1 } }, "required": ["asset_type"] }
          }
        ],
        "additionalProperties": false
      }
    },
    "caption_policy": {
      "type": "object",
      "required": ["reference_text", "copy_reference_caption"],
      "properties": {
        "reference_text": { "type": "string", "enum": ["analysis_only", "forbidden"] },
        "copy_reference_caption": { "type": "boolean", "const": false, "description": "参考花字/caption 绝不复制进最终字幕（硬门）" }
      },
      "additionalProperties": false
    },
    "status": {
      "type": "string",
      "enum": ["awaiting_human", "approved", "in_progress", "completed", "failed", "skipped"]
    },
    "compression": {
      "type": "object",
      "required": ["base_template_id", "base_ref", "kept_slot_ids", "kept_ordinals", "base_section_refs", "total_s", "h1_ok", "h2_ok", "h3_ok", "h4_ok", "capacity_ok", "dur_ok", "all_hard_ok", "input_hash"],
      "properties": {
        "base_template_id": { "type": "string", "minLength": 1 },
        "base_ref": { "type": "string", "minLength": 1 },
        "kept_slot_ids": { "type": "array", "minItems": 1, "uniqueItems": true, "items": { "type": "string", "minLength": 1 } },
        "kept_ordinals": { "type": "array", "minItems": 1, "uniqueItems": true, "items": { "type": "integer", "minimum": 1 } },
        "base_section_refs": { "type": "array", "minItems": 1, "items": { "type": "string", "minLength": 1 } },
        "total_s": { "type": "number", "minimum": 0 },
        "h1_ok": { "type": "boolean" },
        "h2_ok": { "type": "boolean" },
        "h3_ok": { "type": "boolean" },
        "h4_ok": { "type": "boolean" },
        "capacity_ok": { "type": "boolean" },
        "dur_ok": { "type": "boolean" },
        "all_hard_ok": { "type": "boolean", "const": true },
        "input_hash": { "type": "string", "pattern": "^[a-f0-9]{64}$" },
        "solver_version": { "type": "string" },
        "kept_durations": { "type": "array", "items": { "type": "number", "minimum": 0 } }
      },
      "additionalProperties": true
    },
    "semantic_sha256": { "type": "string" },
    "artifact_sha256": { "type": "string" }
  },
  "allOf": [
    {
      "if": { "properties": { "status": { "enum": ["approved", "in_progress"] } } },
      "then": {
        "properties": {
          "slot_bindings": {
            "not": { "contains": { "properties": { "source": { "const": "unbound" } }, "required": ["source"] } }
          }
        }
      }
    },
    {
      "if": { "properties": { "version": { "const": "1.1" } }, "required": ["version"] },
      "then": { "required": ["target_category_id", "category_profile_ref"] }
    }
  ],
  "additionalProperties": false
}
